{
  "formatVersion": 1,
  "id": 4,
  "name": "The Practice Halls",
  "width": 12,
  "height": 10,
  "startX": 5,
  "startY": 8,
  "encounterRate": 0.08,
  "tilesetTheme": "f1",
  "grid": [
    [
      {
        "n": "wall",
        "e": "wall",
        "s": "wall",
        "w": "wall"
      },
      {
        "n": "wall",
        "e": "wall",
        "s": "wall",
        "w": "wall"
      },
      {
        "n": "wall",
        "e": "wall",
        "s": "wall",
        "w": "wall"
      },
      {
        "n": "wall",
        "e": "wall",
        "s": "wall",
        "w": "wall"
      },
      {
        "n": "wall",
        "e": "wall",
        "s": "wall",
        "w": "wall"
      },
      {
        "n": "wall",
        "e": "wall",
        "s": "wall",
        "w": "wall"
      },
      {
        "n": "wall",
        "e": "wall",
        "s": "wall",
        "w": "wall"
      },
      {
        "n": "wall",
        "e": "wall",
        "s": "wall",
        "w": "wall"
      },
      {
        "n": "wall",
        "e": "wall",
        "s": "wall",
        "w": "wall"
      },
      {
        "n": "wall",
        "e": "wall",
        "s": "wall",
        "w": "wall"
      },
      {
        "n": "wall",
        "e": "wall",
        "s": "wall",
        "w": "wall"
      },
      {
        "n": "wall",
        "e": "wall",
        "s": "wall",
        "w": "wall"
      }
    ],
    [
      {
        "n": "wall",
        "e": "wall",
        "s": "wall",
        "w": "wall"
      },
      {
        "n": "wall",
        "e": "wall",
        "s": "wall",
        "w": "wall"
      },
      {
        "n": "wall",
        "e": "wall",
        "s": "wall",
        "w": "wall"
      },
      {
        "n": "wall",
        "e": "open",
        "s": "open",
        "w": "wall",
        "tile": "event"
      },
      {
        "n": "wall",
        "e": "open",
        "s": "open",
        "w": "open"
      },
      {
        "n": "wall",
        "e": "open",
        "s": "open",
        "w": "open",
        "tile": "stairs_up"
      },
      {
        "n": "wall",
        "e": "open",
        "s": "open",
        "w": "open"
      },
      {
        "n": "wall",
        "e": "open",
        "s": "open",
        "w": "open"
      },
      {
        "n": "wall",
        "e": "wall",
        "s": "open",
        "w": "open"
      },
      {
        "n": "wall",
        "e": "wall",
        "s": "wall",
        "w": "wall"
      },
      {
        "n": "wall",
        "e": "wall",
        "s": "wall",
        "w": "wall"
      },
      {
        "n": "wall",
        "e": "wall",
        "s": "wall",
        "w": "wall"
      }
    ],
    [
      {
        "n": "wall",
        "e": "wall",
        "s": "wall",
        "w": "wall"
      },
      {
        "n": "wall",
        "e": "wall",
        "s": "wall",
        "w": "wall"
      },
      {
        "n": "wall",
        "e": "wall",
        "s": "wall",
        "w": "wall"
      },
      {
        "n": "open",
        "e": "open",
        "s": "wall",
        "w": "wall"
      },
      {
        "n": "open",
        "e": "open",
        "s": "wall",
        "w": "open"
      },
      {
        "n": "open",
        "e": "open",
        "s": "door",
        "w": "open"
      },
      {
        "n": "open",
        "e": "open",
        "s": "wall",
        "w": "open"
      },
      {
        "n": "open",
        "e": "open",
        "s": "wall",
        "w": "open"
      },
      {
        "n": "open",
        "e": "wall",
        "s": "wall",
        "w": "open",
        "tile": "event"
      },
      {
        "n": "wall",
        "e": "wall",
        "s": "wall",
        "w": "wall"
      },
      {
        "n": "wall",
        "e": "wall",
        "s": "wall",
        "w": "wall"
      },
      {
        "n": "wall",
        "e": "wall",
        "s": "wall",
        "w": "wall"
      }
    ],
    [
      {
        "n": "wall",
        "e": "wall",
        "s": "wall",
        "w": "wall"
      },
      {
        "n": "wall",
        "e": "wall",
        "s": "wall",
        "w": "wall"
      },
      {
        "n": "wall",
        "e": "wall",
        "s": "wall",
        "w": "wall"
      },
      {
        "n": "wall",
        "e": "wall",
        "s": "wall",
        "w": "wall"
      },
      {
        "n": "wall",
        "e": "wall",
        "s": "wall",
        "w": "wall"
      },
      {
        "n": "door",
        "e": "wall",
        "s": "open",
        "w": "wall",
        "tile": "darkness"
      },
      {
        "n": "wall",
        "e": "wall",
        "s": "wall",
        "w": "wall"
      },
      {
        "n": "wall",
        "e": "wall",
        "s": "wall",
        "w": "wall"
      },
      {
        "n": "wall",
        "e": "wall",
        "s": "wall",
        "w": "wall"
      },
      {
        "n": "wall",
        "e": "wall",
        "s": "wall",
        "w": "wall"
      },
      {
        "n": "wall",
        "e": "wall",
        "s": "wall",
        "w": "wall"
      },
      {
        "n": "wall",
        "e": "wall",
        "s": "wall",
        "w": "wall"
      }
    ],
    [
      {
        "n": "wall",
        "e": "wall",
        "s": "wall",
        "w": "wall"
      },
      {
        "n": "wall",
        "e": "open",
        "s": "open",
        "w": "wall",
        "tile": "treasure"
      },
      {
        "n": "wall",
        "e": "open",
        "s": "open",
        "w": "open"
      },
      {
        "n": "wall",
        "e": "open",
        "s": "open",
        "w": "open",
        "tile": "npc"
      },
      {
        "n": "wall",
        "e": "open",
        "s": "wall",
        "w": "open"
      },
      {
        "n": "open",
        "e": "open",
        "s": "open",
        "w": "open"
      },
      {
        "n": "wall",
        "e": "open",
        "s": "wall",
        "w": "open"
      },
      {
        "n": "wall",
        "e": "locked",
        "s": "wall",
        "w": "open"
      },
      {
        "n": "wall",
        "e": "open",
        "s": "open",
        "w": "locked"
      },
      {
        "n": "wall",
        "e": "open",
        "s": "open",
        "w": "open"
      },
      {
        "n": "wall",
        "e": "wall",
        "s": "open",
        "w": "open",
        "tile": "treasure"
      },
      {
        "n": "wall",
        "e": "wall",
        "s": "wall",
        "w": "wall"
      }
    ],
    [
      {
        "n": "wall",
        "e": "wall",
        "s": "wall",
        "w": "wall"
      },
      {
        "n": "open",
        "e": "open",
        "s": "wall",
        "w": "wall",
        "tile": "treasure"
      },
      {
        "n": "open",
        "e": "open",
        "s": "wall",
        "w": "open"
      },
      {
        "n": "open",
        "e": "wall",
        "s": "wall",
        "w": "open"
      },
      {
        "n": "wall",
        "e": "wall",
        "s": "wall",
        "w": "wall"
      },
      {
        "n": "open",
        "e": "wall",
        "s": "open",
        "w": "wall"
      },
      {
        "n": "wall",
        "e": "wall",
        "s": "wall",
        "w": "wall"
      },
      {
        "n": "wall",
        "e": "wall",
        "s": "wall",
        "w": "wall"
      },
      {
        "n": "open",
        "e": "open",
        "s": "wall",
        "w": "wall",
        "tile": "teleporter"
      },
      {
        "n": "open",
        "e": "open",
        "s": "wall",
        "w": "open"
      },
      {
        "n": "open",
        "e": "wall",
        "s": "wall",
        "w": "open"
      },
      {
        "n": "wall",
        "e": "wall",
        "s": "wall",
        "w": "wall"
      }
    ],
    [
      {
        "n": "wall",
        "e": "wall",
        "s": "wall",
        "w": "wall"
      },
      {
        "n": "wall",
        "e": "wall",
        "s": "wall",
        "w": "wall"
      },
      {
        "n": "wall",
        "e": "wall",
        "s": "wall",
        "w": "wall"
      },
      {
        "n": "wall",
        "e": "wall",
        "s": "wall",
        "w": "wall"
      },
      {
        "n": "wall",
        "e": "wall",
        "s": "wall",
        "w": "wall"
      },
      {
        "n": "open",
        "e": "wall",
        "s": "open",
        "w": "wall",
        "tile": "event"
      },
      {
        "n": "wall",
        "e": "wall",
        "s": "wall",
        "w": "wall"
      },
      {
        "n": "wall",
        "e": "wall",
        "s": "wall",
        "w": "wall"
      },
      {
        "n": "wall",
        "e": "wall",
        "s": "wall",
        "w": "wall"
      },
      {
        "n": "wall",
        "e": "wall",
        "s": "wall",
        "w": "wall"
      },
      {
        "n": "wall",
        "e": "wall",
        "s": "wall",
        "w": "wall"
      },
      {
        "n": "wall",
        "e": "wall",
        "s": "wall",
        "w": "wall"
      }
    ],
    [
      {
        "n": "wall",
        "e": "wall",
        "s": "wall",
        "w": "wall"
      },
      {
        "n": "wall",
        "e": "wall",
        "s": "wall",
        "w": "wall"
      },
      {
        "n": "wall",
        "e": "wall",
        "s": "wall",
        "w": "wall"
      },
      {
        "n": "wall",
        "e": "wall",
        "s": "wall",
        "w": "wall"
      },
      {
        "n": "wall",
        "e": "open",
        "s": "open",
        "w": "wall"
      },
      {
        "n": "open",
        "e": "open",
        "s": "open",
        "w": "open"
      },
      {
        "n": "wall",
        "e": "open",
        "s": "open",
        "w": "open"
      },
      {
        "n": "wall",
        "e": "wall",
        "s": "open",
        "w": "open",
        "tile": "water"
      },
      {
        "n": "wall",
        "e": "wall",
        "s": "wall",
        "w": "wall"
      },
      {
        "n": "wall",
        "e": "wall",
        "s": "wall",
        "w": "wall"
      },
      {